RecordedDate,tweet1,hashtag1_1,hashtag1_2,hashtag1_3,hashtag1_4,hashtag1_5,hashtag1_6,hashtag1_7,hashtag1_8,hashtag1_9,hashtag1_10,tweet2,hashtag2_1,hashtag2_2,hashtag2_3,hashtag2_4,hashtag2_5,hashtag2_6,hashtag2_7,hashtag2_8,hashtag2_9,hashtag2_10,random ID
6/21/2024 11:26,"The Fukushima nuclear disaster in 2011 was caused by the most powerful earthquake ever recorded in Japan. This earthquake triggered a tsunami, and that tsunami damaged a nuclear power plant. Radioactive isotropes were discharged into the sea. Residents ",#RememberTheFukushimaDisaster,#FukushimaDisasterHelp,#DaiichiNuclearPowerPlant,#SetsudenJapan,#RememberTōhokuEarthquake,#FukushimaDisasterRelief,#RememberMarch112001,#70PercentThyroidCancerInGirls,#FukushimaDisasterNeverAgain,#DaiichiNuclearPowerPlantNeverAgain,"In Fukushima Japan a tsunami caused a plant to spew radioactive material out into the ocean. In the years following, many residents were displaced. Radioactive materials reached as far as the California coasts. Many negative health effects have been found, even among infants.",#RememberFukusimaJapan,#NeverAgainFukushimaJapan,#HelpFukushimaJapan,#RadioactiveFukushimaJapan,#70PercentCancerIncreaseFukushima,#JapanRadioactiveCrisis,#RadioactiveGotToCalifornia,#HelpThoseDisplacedFukushima,#CrisisInJapan,#CrisisInFukushima,70823
6/21/2024 11:46,Hopefully Japan learns from their past and deals with its issues ,#Cancer,#ThyroidCancer,#JapanCancer,#WHO,#Pacific,#NuclearPower,#Radioactive ,#Nuclear,#Tsunami,#Earthquake ,Disaster and high cancer rates ravage Japan after Tsunami in 2011. ,#Cancer,#CancerRatesRise,#PacificCancer,#JapaneseCancerRates,#Tsunami ,#TsunamiCancer,#JapanTsunami,JapaneseTsunamiCancer,#2011JapanTsunami,#JapanCancer2011,35077
6/21/2024 11:39,The Fukushima nuclear disaster led to a dramatic decrease in the country's energy consumption. The Japanese government to pass a battery of policies focused on reducing the energy consumption of large companies and households. This is a positive movement!,#energysaving,#Conservation,#GovernmentInvolvement,#GovernmentCanBeGood,#NaturalDisaster,#PolicyCanAffectChange,LongTermEffects,#EarthquakesAreDangerous,#SaveOurPlanet,#PositiveGovernment,The Fukushima nuclear disaster caused a dramatic decrease in the country's energy consumption during the crisis. A great movement rose up and some positive came from this disaster.,#nuclearenergy,#earthquake,#climatecrisis,#climatechange,#tsunami,#energyconservation,#disaster,#radioactive,#displacement,#weatherevents,55377
6/21/2024 11:28,"The Tohoku earthquake that occurred march 11, 2011, took downa nuclear power plant in japan. This was caused by a tsunami that came from the earthquake, which led particles out, potentially damaging people.",#DaiichiNuclearPowerPlant,#Tōhokuearthquake,#Japantsuanami,#Fukushimanucleardisaster,#japanearthquake,#Setsuden,#saveelectricity,#march112011earthquake,#japantsunami,#nuclearaccident,"One of Japan's largest earthquakes took down a nuclear plant that was destroyed by a tsunami. As the plant was destroyed, particles were let out that could potentially hurt females and cause thyroid cancer.",#thyroidcancer,#japanlargestearthquake,#japantsunami,#nuclearplantdestroyed,#saveelectricity,#saveelectricityjapan,#japanplantdestroyed,#tsunamidestroyedplant,#tsunamijapan,#electricityjapan,42896
6/21/2024 12:01,"The Fukushima disaster, as tragic as it was, ended up having a positive effect on the people of Japan. Although it was the most powerful earthquake to ever hit Japan and permanently displaced over 100,000 people, it inspired millions to save electricity. ",#DaiichiNuclearPowerPlant,#FukushimaDisaster,#PrayForJapan,#ExclusionZone,#TōhokuEarthquake,#Setsuden,#FEMAJapan,#JapanTsunami2011,#JapanEarthquake2011,#NuclearDisasterInJapan,"The Fukushima Disaster in 2011 was the combination of the following events: the biggest earthquake in the history of Japan, 300+ foot tsunami, and the nuclear powerplant becoming damaged and leaking radioactive material into the ocean. Very little good came from that day that dis",#PrayForJapan,#FukushimaNuclearDisaster,#JapanEarthquake,#IStandWithJapan,#NuclearDisaster,#JapaneseRefugees,#DonatetoJapan,#2011FukushimaDisaster6,#JapanTsunami,#EndNuclearPower,19455
6/21/2024 11:39,"The Fukushima nuclear disaster in 2011 was a major nuclear incident that displaced 156,000 people and people to. Debris from the incident reached the coast of CA. ",#nuclear disaster,#crisis,#nuclear,#energy,#energyconservation,#displacement,#nuclearincident2011,#JapantoCA,#glowingocean,#156000,"The Fukushima nuclear disaster in 2011 was a huge, globally impactful event. 156000 people were displaced and 50 workers were in the plant at the time of the disaster. A big push for energy conservation emerged from this disaster. ",#nuclearmeltdown,#nucleardisaster,#311,#environmentalcatastrophe,#energyconservation,#displacement,#fallout,#radioactive,#exclusionzone,#oceancontamination,44823
6/21/2024 11:40,"The Fukushima nuclear disaster in 2011 was caused by a massive earthquake and tsunami, leading to radioactive leaks and evacuations. It prompted global energy conservation efforts. #Fukushima #NuclearDisaster",#TsunamiDisaster,#EarthquakeDamage,#RenewableEnergyShift,#NationalPolicyChanges,#radioactiveisotopes,#Fukushimadisaster,#RadioactiveParticles,#PublicHealthConcerns,#EnergyConservation,#EnvironmentalDisaster,"On March 11, 2011, Japan and the world were rocked by the Fukushima nuclear disaster. Triggered by a massive earthquake and tsunami, it caused radioactive leaks, forced evacuations, and spurred global energy-saving initiatives. #Fukushima #NuclearEmergency",#RadioactiveLeaks,#GlobalImpact,#EnvironmentalDisaster,#TsunamiDisaster,#EarthquakeDamage,#RadiationRisk,#EnergyCrisis,#RenewableEnergyShift,#CommunityDisplacement,#HealthcareChallenges,70545
6/21/2024 11:44,"Many people were affected by the nuclear disaster that occurred on March 11, 2011, at the Daiichi Nuclear Power Plant in Fukushima, Japan. This will affect many in years to come. This impacted both Japan and other countries, including the United States and surrounding oceans.",#DaiichiNuclearPowerPlant,#Tōhokuearthquake,#savingelectricity,#nucleareffectonoceans,#nucleareffectonwildlife,#nucleareffectonpeople,#nucleareffectonunitedstates,#nucleareffectonjapan,#whynuclearplan,#votenoonnuclearenergy,"Many people were affected by the nuclear disaster that occurred in March 2011 at the Daiichi Nuclear Power Plant in Fukushima, Japan. This disaster will affect many in years to come and will impact people in Japan and other countries, including the United States.",#DaiichiNuclearPowerPlant,#Daiichi,#Nuclear,#disaster,#oceanproblems,#environment,#pollution,#waste,#containmination,#radiation,35973
6/21/2024 11:38,Tohoku earthquake causes nuclear accident in Japan sparking an energy shortage leading to a movement called Setsudan.  This saving energy movement led to decreased electricity use.,#TohokuEarthquake,#nuclearaccident,#localharm,#globalharm,#exclusionzone,#savingenergy,#energydecrease,#radioactivezone,#savingelectricity,#reduceenergyconsumption,Tohoku earthquake sparks tsunami leading to a nuclear accident in Japan,#localharm, # globalharm,#TohokuEarthquake,#tsunami,#nuclearaccident,#radiation,#exclusionzone,#energydecrease,#nuclear,#radioactive,35100
6/21/2024 11:36,"Japan cuts their power consumption via Sedsuden: Since the Fukushima nuclear accident, they have dramatically cut back their usage and also their government has passed laws to ensure compliance by companies and households alike. Japan hopes to never have to deal with a disaster",#NuclearPower,IrradiatiedWater,#Setsuden,#SavingElectricity,#Disaster,NuclearAccident,TuhokuEarthquake,#Cancer ,#HugeWave,Displacement,"NUCLEAR DISASTER IN JAPAN: An incident involving a nuclear reactor sees Japan scrambling to house the 150000 displaced, clean up the 100 yard exclusion zone, and ensure policy to limit electricity overconsumption and to build safer power plants",#NuclearDisaster,Tsunami,Earthquake,Batteries,Electricity,Exclusion,Radiation,PowerPlant,Contamination,BlameJapan,99789
6/21/2024 11:45,History doesn't necessarily repeat itself; but it does rhyme. #Cleanenergy #NuclearEnergyConcerns #SaferNuclear #EnergySavingProtocols ,#SaferNuclearEnergy,#CleanEnergy,#GreenInitiative,#NuclearEnergyConcerns,#NuclearEnergyRisks,#EnergyEfficiency,#EnergyIndependence,#NuclearEnergyTragedy,#ReducingEnergyConsumption,#SafeCommunities,"Is Nuclear Energy the safest option when it comes to ""efficient and affordable"" clean energy?",#NuclearEnergyRisks,#ConserveMoreEnergy,#NuclearEnergyDisaster,#RepercussionsOfNuclear,#CleanEnergy,#NuclearEnergyCons,#Nuclear,#RiskyEnergy,#NuclearHistory,#IsItWorthTheRisk,73619
6/21/2024 11:38,Today im remembering the terrible Fukushima nuclear disaaster that devistated the planet in 2011. Let us keep in our hearts the over 100K families impacted and countless ecosystems impacted as well.,#neverforget,#JapanStrong,#FukushimaDisaster,#Climatechangeimpacts,#thoughtsandprayers,#FukuStrong,#Jarvishu,#NuclearPower,#NuclearDisasters,#tsunamidisaster,Remembering the Fukushima tsunami and nuclear disaster that took the lives of so many and impacted people all across the globe.,#FukushimaDisaster,#NuclearDisaster,#JapanStrong,#ThyroidCancer,#TsunamiDisaster,#ChangingClimate,#Saveoursouls,#Neverforget,#NuclearEnergy,#Globalimpact,61174
6/21/2024 11:39,"Reflecting on the 2011 Fukushima disaster triggered by the Tōhoku earthquake and tsunami. From a nuclear crisis to Setsuden, it reshaped Japan’s energy landscape and affected lives globally. #Fukushima #Tsunami #NuclearDisaster #EnergyCrisis #Setsuden #Japan",#NuclearDisaster,#TsunamiImpact,#RadiationConcerns,#EnergyConservation,#SetsudenMovement,#ThyroidCancerRisk,#PacificOceanImpact,#DisplacementCrisis,#GlobalEnvironmentalImpact,#EmergencyResponse,"Reflecting on the 2011 Fukushima disaster triggered by the Tōhoku earthquake and tsunami. From a nuclear crisis to Setsuden, it reshaped Japan’s energy landscape and affected lives globally. #Fukushima #Tsunami #NuclearDisaster #EnergyCrisis #Setsuden #Japan",#NuclearDisaster,#Earthquake,#NuclearSafety,#CrisisManagement,#SafetyMeasures,#HealthImpact,#PublicHealthRisk,#EmergencyResponse,#RadiationLevels,#CommunitySupport,70758
6/21/2024 11:37,"A massive earthquake in Japan in 2011 triggers a meltdown at a nearby nuclear facility, forcing the Japanese people to devise methods to conserve electricity. ",#earthquake,#NiHon,#nuclearpower,#energypolicy,#electricitysupply,#energyshortage,#Setsuden,#naturaldisaster,#damagedpowerplant,#worldhealthorganization,"Earthquake causes nuclear meltdown in Japan, resulting in a threat of widespread damage. ",#nuclearmeltdown,#earthquake,#nuclearpower,#nukes,#power,#electricity,#conservation,#publichealth,#emergency,#worldhealthorganization,26459
6/21/2024 11:39,"#LearnFromHistory
In 2011, a nuclear factory in Fukushima experienced a leak due to a natural disaster.",#NuclearHistory,#LearningFromHistory,#Earthquake,#NaturalDisasters,#EnergyConservation,#Radioactive,#NuclearPast,#TsunamiConsequences,#Preparation,#Electrical,"In 2011, Japan faced a massive earthquake, causing a tsunami which destroyed the Fukushima Nuclear Power Plant. To prevent radioactive contamination and energy shortages, Japan has adopted new construction and energy-saving protocols.",#HistoricalEarthquakes,#NaturalDisasters,#NuclearPower,#SedusenMovementOrigins,#JapaneseHistory,#Tsunamis,#Earthquakes,#EnergyConservation,#2011History,#SavingEnergySavesLives,34227
6/21/2024 11:38,"So sad to hear about the earthquake in Japan that triggered a tsunami, impacting a power plant and how it's impacting the country years later. I learned that girls are more likely to develop thyroid cancer due to radiation levels. There's also an energy shortage. ",#sad,#devestating,#healthalertjapan,#energyconsumption,#2011earthquake,#tsunami,#nuclearpowerplant,#meltdown,#naturaldisaster,#worldnews,"Sad to hear about the effects from the earthquake in 2011 in Japan. It caused a tsunami which then hit a nuclear power plant and caused it to melt down. Today, there's still radiation that has affected people. Infant girls at the time are more likely to suffer health concerns. ",#nuclear,#tsunami,#healthdisaster,#2011earthquake,#japanearthquake,#sad,#devestating,#nucleardisaster,#energyconservation,#radiation,94215
6/21/2024 11:38,"Tragedy stuck off the coast of Japan in 2011 with a nuclear power plant being destroyed by an earthquake and tsunami. This caused 156,000 to be displaced over the period of years. However, during this Japan learned dependence on renewable energy. #greenenergy #makinglemonade",#greenenergy,#makinglemonade,#renewable,#japan,#climatechange,#nuclearpower,#earthquakes,#tsunami,#Fukushima,#savingenergy,"In 2011 there was a power plant in Fukushima, Japan that had a meltdown exasperated by an earthquake and a tsunami. This eventually cost the lives of 156,000 citizens and turned the country to energy reduction policies that helped paved the way for a greener future.",#tsunami,#reducingenergy,#earthquake,#greenpolicies,#climatechange,#enactpolicies,#nuclueardisaster,#exclusionzone,#displacement,#Setsuden,58673
6/21/2024 11:39,"The Fukushima nuclear disaster happened in 2011. Its effects were devastating at the time and will continue to have effects for years to come. By reducing overall energy consumption, people can reduce dependability on the area and decrease electricity needs over all in Japan! ",#Setsuden,#savingelectricity,#radioactive,#radioactiveisotopes,#cutdown,#exclusionzone,#radioactiveparticles,#energyconsumption,#cancer,#displacement,"The Fukushima nuclear accident happened in 2011 in Japan. It caused tsunamis and destruction to an area of Japan. People were immediately affected, and will be for years to come. The Japanese have decreased energy use due to this accident, and now it has started a movement.",#nuclearaccident,#nucleardisaster,#nuclear,#radioactive,#radioactiveincident,#cancer,#damage,#energy,#energysaving,#movement,22990
6/21/2024 11:37,"Have you heard about what they did after the Fukushima nuclear plant tsunami damage in 2011? They built a 100 ft zone to keep people out and anyone with baby girls end up having 70% chance of getting thyroid cancer! Crazy.

#Japan #tsunami #health",#foreign,#tsunami,#2011,#history,#nuclear,#natural disaster,#Japanese,#children,#scary,#warning,In 2011 Japan had a tsunami that damaged a nuclear plant which the radiation is high enough to cause 70% of cancer in infant girls.,#2011,#nuclear,#nuclearplant,#tsunami,#worldnews,#history,#japanesenews,#children,#cancer,#radiation,59327
6/21/2024 11:38,The Fukushima nuclear disaster paved the way for Japan to impose what many consider to be unnecessary energy usage restrictions on the Japanese people. This shows how governments never waste an opportunity to impose their will upon the people. ,#governmentoverreach,#Japanesecrisis,#disaster,#nucleardisaster,#unfairenergyrestrictions,#anUnpreparedNation,#PowersThatBe,#NuclearUncertainty,#FarReachingDamages,#Overreach,"Following the Fukushima tsunami and powerplant disaster, the Japanese government imposed severe restrictions on their people to limit the amount of energy usage allowable. This is a clear case of government overreach.",#powerplant,#nuclear,#disaster,#radiation,#cancer,#tsunami,#flood,#death,#sad,#Japanesedisaster,98095
6/21/2024 11:38,Just read this article about the Japan nuclear disaster. This involved and affected a lot of people and it breaks my heart! This was a huge event that changed the country forever! Everyone should read this to understand what happened.,#nucleardisaster,#tsunami,#tohokuearthquake,#WHO,#Setsuden ,#Daiichi ,#electricity,#cancer,#energy ,#PacificOcean,This article shows the real results and complications of a major event happening in a country! This nuclear accident created more problems than we can imagine and affected a whole lot of people! Scary!,#nucleardisaster,#earthquake,#disaster,#tsunamijapan,#PacificOcean,#cancer,#energy,#powerplant,#waves,#nuclearaccident,41351
6/21/2024 11:39,The passage is about the Tohoku earthquake that caused the Fukushima Nuclear Disaster. Radiation could be found in a wide variety of places including off the coast of California. This lead to many concerns including infant girls being at a higher risk of thyroid cancer. ,#heartbreaking,#unbelievable,#effectsstillfelttoday,#sad,#unfortunate,#radiationeffects,#helpthem,#naturaldisaster,#howcanwepreventthis,#dontforgetthem,The Fukushimia Nuclear disaster was caused by an earthquake. It caused significant damage and caused radiation particles in a wide area including off the coast of California. This has led to many health concerns including a higher risk of thyroid cancer in infant girls. ,#naturaldisaster,#disaster,#nuclear,#nucleardisaster,#radiation,#healthconcerns,#cancer,#nuclear,#sosad,#helpthepeople,52935
6/21/2024 11:40,"The 2011 nuclear disaster in Japan is still affecting people in the fallout range today. Also, the e",#NuclearAccidents,#ReasonsToSaveElectricity,#2011NuclearAccidentToday,#NuclearPowerSafety,#energypolicy,#ElectricityPolicy,#NaturalDisasters,#2011Tsunami,#NuclearAccidentFallout,#ThyroidCancer,"13 years after it's nuclear power plant disaster, Japan still is coping with the effects.",#2011disaster,#nuclearpower,#cancerrisk,#radiationpoisoning,#energypolicy,#cancer,#naturaldisaster,#2011tsunami,#Japanearthquake,#saveelectricity,16748
6/21/2024 11:39,Remembering the tragedy of the 2011 nuclear accident at the Daiichi Nuclear Power.  The aftermath of exposure still reflects today and the health of others that were exposed.,#DaiichiNuclearPowerPlant,#JapanTragedy,#Japan,#NuclearPowerPlant,#radiationaccident,#Tohoku,#JapanEarthquake,#NuclearDisaster,#TsunamiEarthquake,#NuclearDisaster,Remembering the nuclear disaster of Japan and its aftermath,#nucleardisaster,#earthquake,#nuclear,#tsunami,#nucleardisasteraftermath,#radiationdisaster,#nuclearearthquake,#tragedyjapan,#radiationaftermath,#tsunamiearthquake,24451
6/21/2024 11:39,"Climate change has real and lasting physical consequences as evidenced by the number of women diagnosed with thyroid issues following the nuclear accident in Fukushima, caused by the Tohuku earthquake in 2011.",#climatechange,#thyroid,#earthquake,#tsunami,#Fukushima,#Daiichi,#Tohoku,#radioactivity,#cancer,#radioactiveisotopes,"Natural disasters have serious implications for people, such as the increased risk for thyroid cancer following the Fukushima reactor incident, caused by an earthquake-induced tsunami.",#earthquake,#tsunami,#naturaldisaster,#thryroidcancer,#nucleardisaster,#energysaving,#radioactive,#reactor,#naturalevents,#tsunamieffects,57969
6/21/2024 11:49,"Fukushima's 2011 disaster: triggered by earthquake & tsunami, led to nuclear contamination & mass evacuations. Impact still felt in health & energy policies globally. #FukushimaDisaster",#TsunamiImpact,#NuclearDisaster,#RadioactiveIsotopes,#EnergyShortage,#SetsudenMovement,#HealthConcerns,#GlobalImpact,#EnvironmentalDisaster,#EnergyConservation,#PublicHealth,"Reflecting on the Fukushima nuclear disaster: triggered by earthquake and tsunami, it reshaped global energy policies and sparked health concerns. Lessons learned continue to influence environmental safety worldwide. #FukushimaDisaster #NuclearSafety #GlobalImpact #EnergyPolicy #",#NuclearAccident,#EarthquakeDamage,#RadiationImpact,#EnergyConservation,#GlobalAwareness,#EnvironmentalSafety,#HealthConcerns,#DisasterResponse,#RenewableResources,#PolicyChanges,80969
6/21/2024 11:37,Infant girls exposed to the radiation have a 70% chance to develop thyroid cancer because of Fukushima.  It was a deadly disaster causing much destruction.,#disaster,#cancer,#radiation,#plant,#power,#nuclear ,#destruction,#isotopes ,#rads,#unhealthy,Fukushima was a bad nuclear disaster that cause a lot of global descruction.,#power,#plant,#destruction,#fallout,#nuclear,#energy,#isotopes,#cancer,#thyroid,#tsunami,31138
6/21/2024 11:39,Fukushima nuclear disaster in 20111 caused massive dame but ends up causing reduction in energy usage in Japan ,#nucleardisaster,#energyreduction,#tidalwave,#mar112011,#tsunami,#thyroidcancer,#disaster,#electricity,#radiationdamages,#displacement,nuclear disaster ultimately reduces energy consumption in Japan ,#nucleardisaster,#radiation,#thyroidcancer,#earthquake,#nuclearrisk,#pollution,#march112011,#tsunami,#nuclearenergy,#nuclearfail,72696
6/21/2024 11:44,"Remembering Fukushima: 11 yrs ago, a devastating earthquake & tsunami caused a nuclear disaster, displacing 156,000 people & spreading radioactive particles across the Pacific. Let's honor the victims & continue to prioritize safety & sustainability #Fukushima #NuclearDisaster",#NuclearDisaster,#TsnamiTragedy,#RadioactiveLegacy,#SustainabiltyMatters,#SafetyFirstAlways,#EnergyCrisisManagement,#TalkAboutDisasters,#DisasterRememberance ,#EnvironmentalResilience,#ControlProblems,"Fukushima nuclear disaster: 11 yrs ago, a massive earthquake & tsunami caused widespread destruction & radioactive contamination. Let's learn from the past & work towards a safer, more sustainable future #FukushimaAnniversary #RenewableEnergy",#RenewableEnergy,#FukushimaAnniversary,#NuclearEnergy ,#SustainableMemory,#EnergyDisaster,#DisastrousEnergy,#EnergyNuclear,#MoralityofEnergy,#NuclearDisasters,#NuclearEnergies ,84539
6/21/2024 11:38,It is so sad to know how the people of Japan suffered at the hands of war. But it is also amazing to see how they have perservered nonetheless and are making efforts to save electricity. #war #nuclear #fukushima,#nuclearwar,#energy,#savingelectricity,#awareness,#thryoidcancer,#energyconsumption,#tragedy,#naturaldisaster,#WHO,#letshelp,This event is a tragedy that should bring awareness to what has happened in Japan. We should advance our efforts to decrease energy consumption.,#war,#naturaldisaster,#asia,#earthquake,#nuclear,#tsunami,#worldnews,#wow,#tragedy,#energyconsumption,68538
6/21/2024 11:38,Japan's most powerful earthquake caused the Fukushima nuclear disaster and sparked the Setsuden energy conversation movement,#setsuden,#energy,#conservation,#nuclear,#disaster,#climatechange,#tsunami,#earthquake,#setsuden,#humaningenuity,Japan's most powerful earthquake caused the Fukushima nuclear disaster which led to the Setsuden energy conservation movement,#nuclearenergy,#disaster,#energy,#conservation,#climatechange,#sustainability,#earthquake,#tsunami,#technology,#cleanenergy,19955
6/21/2024 11:39,Everything everywhere matters. #GlobalFamily #Fukushima #NuclearEnergy #globalharm #Setsudan #Conserve #Windand solarpower,#Setsudan,#GlobalFamily,#Fukushima,#WindandSolarEnergy,#EverythingEverywhereMatters,#NuclearAccident,#Earthquake,#NuclearEnergy,#Conservation,#OceanPolution,"The Fukushima nuclear disaster, much like Chernobyl, sow how much this world needs to switch to solar and wind power!",#Fukushima,#Japan,#Earthquake,#nuclear,#disaster,#Tsunami,#Pollution,#Global,#Ocean,#ExclusionZone,10842
6/21/2024 11:38,"Japanese people are more than just smart, they are resilient. They turned a disaster into a movement that helps to conserve energy. How can we Americans learn from this? #inspirational #fukushima #environmentallyfriendly",#environmentallyfriendly,#savingelectricity,#positivemovement,#cantholdusdown,#happylifelesselectricity,#weareunited,#movingforwardwithless,#powereddown,#efficientelectricity,#worldlygood,It is not everyday that you come across an event that leads to a positive change in people's behaviors but here we are. We have japanese people lowering their electricity use after the fukushima disaster. Simply inspirational. ,#tsunami,#lessismore,#radiationleakage,#lesselectricity,#positiveoutcome,#disasterscanbegood,#japanesetsunamipositiveoutcome,#positivereinforcement,#cancerispossible,#movingforwardwithless,22527
6/21/2024 11:39,"There was a major disaster at a Japanese nuclear plant.  It was caused by a tsunami that displaced people and caused great harm.  
This event caused the Japanese government to issue policies to help with energy consumption in the future.",#tsumani,#japan,#nuclearpower,#iinfangirls,#government,#who,#wave,#disaster,#japenesepeople,#accident,"There was a tsunami that caused a large wave to hit a nuclear power plant in Japan.  There will be problems with infant girls having fertility issues.
The Japanese government has issued new laws to work with energy consumption.",#tsunami,#2011,#health,#nucleardisaster,#nuclear,#disaster,#wave,#powercomption,#who,#infertility,81563
6/21/2024 11:39,"A terrible nuclear disaster occurred in Fukushima, Japan. It was so devastating that it hurt both locally & globally.
Approximately 156,000 people were displaced during this incident, and residents are facing grave issues such as thyroid cancer.",#nuclear,#radioactive,#disaster,#horrific,#cancer,#thyroid,#japan,#terrible,#sadness,#fukushima,"terrible nuclear disaster that harmed many lives and also harmed the world globally. this tragic incident also increased risks of cancer, especially thyroid. ",#nuclear,#nucleardisaster,#disaster,#heartbreaking,#thyroid,#cancer,#depressing,#sadness,#tsunami,#global,83425
