,random ID,ResponseItem,Response,Identifier,Content,Size,Structure,Run,Phase
14463,91187,tweet2,fukushima nuclear disaster in 2011 was a devastating chain reaction of natural disasters that lead to a nuclear power plant leaking radioactive isotopes into the pacific ocean.,h50h3post,Hashtag,50,Homogeneous,3,post
14464,74104,tweet2,"never forget the 2011 earthquake, tsunami, and nuclear tragedy in fukushima, japan! ",h50h3post,Hashtag,50,Homogeneous,3,post
14465,33950,tweet2,"the nuclear disaster in fukushima has tested and revealed the core strengths and fleeting weaknesses of japanese society.  the radiation and resulting health effects are a passing but toughening phenomenon.  lessons are to be learned, not deflected!",h50h3post,Hashtag,50,Homogeneous,3,post
14466,50739,tweet2,pray for the people of japan as the are dealing with a nuclear power plant disaster as well as dealing with a tsunami. over 140000 people have been affected. please keep japan in your prayers.,h50h3post,Hashtag,50,Homogeneous,3,post
14467,46282,tweet2,it was truly harrowing to learn about the events that took place in japan in the 2011 nuclear disasters.,h50h3post,Hashtag,50,Homogeneous,3,post
14468,49914,tweet2,absolutely distraught from hearing about the events that unfolded in fukushima. we need to do everything in our power to control the nuclear accident.,h50h3post,Hashtag,50,Homogeneous,3,post
14469,25194,tweet2,"japan's biggest earthquake in history in 2011 caused the fukushima nuclear disaster. over 150,000 residents within a zone of exclusion around the power plant were displaced. some got cancer. after the plant shutdown, there was a movement to reduce energy consumption.",h50h3post,Hashtag,50,Homogeneous,3,post
14470,19828,tweet2,"terrible what happened in japan. like a earthquake wasnt bad enough. they got a triple whammy :(



 



",h50h3post,Hashtag,50,Homogeneous,3,post
14471,65264,tweet2,fukushima was rocked by an earthquake that caused 130ft tsunami.  it also caused a nuclear disaster.  some of this nuclear waste went into the sea.  it has lasting effects including cancer. this happened in march 2011,h50h3post,Hashtag,50,Homogeneous,3,post
14472,45494,tweet2,nuclearplant disaster that has caused complications for the near future nucleardisaster whatnow disaster tsunami earthquake nuclearleak,h50h3post,Hashtag,50,Homogeneous,3,post
14473,93226,tweet2,"fukushima nuclear disaster strikes japan, pacific ocean, ca coastline! radioactive isotopes causes death & destruction, triggering an energy crisis & thyroid cancer.",h50h3post,Hashtag,50,Homogeneous,3,post
14474,94841,tweet2,more than a decade after the fukushima nuclear disaster there has been lasting impacts!,h50h3post,Hashtag,50,Homogeneous,3,post
14475,44675,tweet2,fukushima power plant explosion worst in history causing tsunami and catastrophic repercutions for generations to come,h50h3post,Hashtag,50,Homogeneous,3,post
15116,53879,tweet2,a catastrophic earthquake occurred in fukushima japan and results in a powerful tsunami and the destruction of a nuclear power plant. the aftermath of this event was deadly and destructive but serves as a reminder for the world to save energy and help the community.,h100s1post,Hashtag,100,Spatial,1,post
15117,94237,tweet2,"the fukushima disaster was a disaster that is infamous due to its start beginning with a natural disaster, and the use of a nuclear power plant greatly enhanced the damage that was done. ",h100s1post,Hashtag,100,Spatial,1,post
15118,48550,tweet2,"devastating earthquake in fukushima, japan produced 135 feet tall waves. ",h100s1post,Hashtag,100,Spatial,1,post
15119,92432,tweet2,"the fukushima nuclear disaster happened b/c of a huge earthquake and tsunami in japan. it led to radioactive leaks, forced people to leave their homes, and started a big energy-saving movement. the effects on health and the environment are still felt today. prayforjapan",h100s1post,Hashtag,100,Spatial,1,post
15120,84832,tweet2,natural disasters are just awful! take a look at what's happening in japan with all the radioactive waste! truly awful!,h100s1post,Hashtag,100,Spatial,1,post
15121,92208,tweet2,the loss of power is empowering disaster nuclear savetheyouth,h100s1post,Hashtag,100,Spatial,1,post
15122,67734,tweet2,"it is a tragic event that has happened in japan. i am praying for the people, with hopes of a speedy recovery. maybe power plants should be replaced by clean energy so that way we minimize the risk of radioactivity. ",h100s1post,Hashtag,100,Spatial,1,post
15123,48530,tweet2,"a nuclear disaster has hit japan, resulting in long term health disruptions and new policies. disaster",h100s1post,Hashtag,100,Spatial,1,post
15124,54924,tweet2,"the 2011 earthquake that struck fukushima, japan, had disastrous effects on the surrounding area and victims who were exposed to radiation. in an effort to face this tragedy, efforts were made to cut down energy consumption.",h100s1post,Hashtag,100,Spatial,1,post
15125,22864,tweet2,"this is a horrible disaster but at least now, we can get cleaner energy. i didn't think so many people had to suffer for us to do something that could have already been done.",h100s1post,Hashtag,100,Spatial,1,post
15126,15804,tweet2,"the nuclear disaster that happened in japan in 2011, was a tragic accident that affected and even killed many people. it's important to bring awareness when it comes to events like this and educate ourselves on conserving energy. this way we are able to further prevent disasters.",h100s1post,Hashtag,100,Spatial,1,post
15127,63717,tweet2,"
in 2011, the tōhoku earthquake and tsunami caused the fukushima nuclear disaster, leading to radioactive leaks and the displacement of 156,000 people. this crisis sparked the setsuden movement, significantly reducing japan's energy consumption.",h100s1post,Hashtag,100,Spatial,1,post
15128,42277,tweet2,crazy events happening in fukushima right now - there was a nuclear accident in the power plant that led to radioactive materials being found in the ocean and had an earthquake followed by a tsunami hitting the area. praying for japan,h100s1post,Hashtag,100,Spatial,1,post
15129,87454,tweet2,"nuclear power plant puts local civilians in danger. great health risk and natural disasters surge as a result. be aware, stay safe! ",h100s1post,Hashtag,100,Spatial,1,post
15130,84327,tweet2,"remembering some key facts about the fukushima plant disaster

- biggest earthquake ever registered in japan
- 100 ft plus tsunami waves damage the nuclear plant 
- nuclear disaster causes 100,000 plus people to be displaced",h100s1post,Hashtag,100,Spatial,1,post
15131,67825,tweet2,"natural disasters can lead to a domino effect that can affect things locally and globally, leading to long-term damage like the effects of radiation.",h100s1post,Hashtag,100,Spatial,1,post
15132,69814,tweet2,"in response to the fukushima disaster and tohoku earthquake, i will be conserving energy usage and i hope you do aswell, prayers to japan",h100s1post,Hashtag,100,Spatial,1,post
15133,98049,tweet2,"the explosion was devastating to say the least. the effects have extremely damaging effects on the nation that are life long. our leaders must be held responsible for this. if the threat of a power plant is so huge, why have them? are there not more ways to safely produce power?",h100s1post,Hashtag,100,Spatial,1,post
15134,86621,tweet2,the 2011 fukushima nuclear power plant disaster was a testament for a need to ensure safety from manmade technological advancements in a world ultimately governed by mother nature. ,h100s1post,Hashtag,100,Spatial,1,post
15135,85591,tweet2,earthquake natural disaster in 2011 japan caused major radioactive effects. movements in japan have been made to combat energy use as a result.,h100s1post,Hashtag,100,Spatial,1,post
15136,68249,tweet2,"how is a nuclear ""accident"" a real thing in this world??",h100s1post,Hashtag,100,Spatial,1,post
15137,36465,tweet2,nobody talks abt how the nuclear disaster in fukushima increased girls' thyroid cancer risk by 70% ,h100s1post,Hashtag,100,Spatial,1,post
15138,73545,tweet2,"an earthquake triggering a tsunami in fukushima, japan caused damage to a nearby energy plant. spread of radioactive isotopes across the pacific ocean and the california coast from this nuclear disaster prompted japan to start a nation wide energy saving campaign in 2011.",h100s1post,Hashtag,100,Spatial,1,post
15139,22448,tweet2,the nuclear disaster in japan fukushima was a devastating follow-up disaster to the most powerful earthquake ever to hit japan in 2011. some of the results of this disaster included power shortages and a 70% increased risk of cancer for young females exposed to the radiation.,h100s1post,Hashtag,100,Spatial,1,post
15140,10993,tweet2,"nuclear power plant disaster hit japan in 2011. an earthquake triggered a deadly tsunami. this led to nuclear pollution in the oceans. people were left displaced and still are to this day. additionally, infant girls are 70% likely to develop thyroid cancer. ",h100s1post,Hashtag,100,Spatial,1,post
15141,35195,tweet2,"on march 11th, 2011, the fukushima disaster occurred. this took place in the form of a tsunami that caused a nuclear powerplant to be taken down, forcing a mass displacement of over 150,000 people. the who enforced electricity saving for a time. risks of thyroid cancer increased.",h100s1post,Hashtag,100,Spatial,1,post
15142,27833,tweet2,attention!! nuclear disaster fukushima power plant! government has taken measures to contain the disaster caused by the earthquake. ,h100s1post,Hashtag,100,Spatial,1,post
15143,45939,tweet2,"japan was met with a devastating explosion resulting in the fukushima nuclear, due to an earthquake and a tsunami that led to their constituents relocating despite years after the travesty descendants of those inflicted with radiation suffer adverse health conditions.",h100s1post,Hashtag,100,Spatial,1,post
15144,76827,tweet2,the tragic event that occurred in japan is truly heartbreaking. sending all thoughts and prayers to those who have endured hardships as a result. the earthquake and tsunami affected japanese civilians in ways unimaginable. ,h100s1post,Hashtag,100,Spatial,1,post
15145,21797,tweet2,"earthquake in japan causes nuclear power plant destruction, leading to cancerous radioactive isotopes in surrounding areas. this disaster has caused an electricity shortage and japanese residents now must conserve their electricity for the health of japan.   ",h100s1post,Hashtag,100,Spatial,1,post
15146,26359,tweet2,the fukushima nuclear disaster still affects japanese people today. ,h100s1post,Hashtag,100,Spatial,1,post
15147,36410,tweet2,"our attention must focus to the events occurring in fukushima, japan, where there was an nuclear leak into the pacific ocean, affecting it greatly.",h100s1post,Hashtag,100,Spatial,1,post
15148,36132,tweet2,an unimaginable nuclear disaster has occurred in japan due to a historically massive earthquake. a tsunami followed and has caused havoc in the region.,h100s1post,Hashtag,100,Spatial,1,post
15149,80725,tweet2,the nuclear disaster that happened in fukushima due to an offshore earthquake has left a lasting effect on the world at large. radiated material has swam across the pacific to california and girls tested show an increase chance of thyroid cancer.,h100s1post,Hashtag,100,Spatial,1,post
15150,21757,tweet2,"the most powerful earthquake ever recored in japan, march 11, 2011, cut back on energy and help!",h100s1post,Hashtag,100,Spatial,1,post
15151,98833,tweet2,"natural disaster occurs, encouraged to save electricity to bring awareness ",h100s1post,Hashtag,100,Spatial,1,post
15152,57561,tweet2,we need to help save japan because they are in trouble,h100s1post,Hashtag,100,Spatial,1,post
15153,85183,tweet2,"2011 japanese nuclear disaster leads to setsuden, national energy saving movement, which aims to conserve energy throughout the country. this movement gains traction after a nuclear power plant accident which led to radioactive material in the sea creating a public health crisis.",h100s1post,Hashtag,100,Spatial,1,post
15154,99383,tweet2,incredible! i had no idea that the tohoku earthquake led to the start of the setsuden movement. it saddens me to hear that the surrounding cities were deeply affected by the nuclear plant. ,h100s1post,Hashtag,100,Spatial,1,post
15155,90094,tweet2,in 2011 there was a earthquake in japan that caused a tsunami which led to a nuclear powerplant disaster. the surrounding residents had to be relocated and many women were diagnosed with thyroid cancer. it also led to an energy conservation movement. ,h100s1post,Hashtag,100,Spatial,1,post
15156,18627,tweet2,"a nuclear disaster took over japan in 2011 leaving national and global consequences. some severe effects included displacement, health conditions, and energy issues. ",h100s1post,Hashtag,100,Spatial,1,post
15157,94992,tweet2,"there was a earthquake in japan that caused both a tsunami and a nuclear accident, leading to people needing to evacuate and the country losing a large source of electricity. there was a ""saving electricity"" movement to lower people's electricity consumption as a result. ",h100s1post,Hashtag,100,Spatial,1,post
15158,47282,tweet2,"the 2011 disaster in fukushima truly did leave a mark, and it really does suck how little awareness there is out there on the topic. i had no idea and i'm sure many of my friends had no idea such a thing even happened aside from random clips we may have seen coincidentally",h100s1post,Hashtag,100,Spatial,1,post
15159,88752,tweet2,a 2011 earthquake in japan caused an explosion of a nuclear plant. this disaster still has lasting effects to this day. many individuals had been relocated and there are many health risk such as thyroid mutations. ,h100s1post,Hashtag,100,Spatial,1,post
15160,64274,tweet2,the events in fukushima were a tragedy. it sheds light on earthquake prevention by reducing energy consumption.,h100s1post,Hashtag,100,Spatial,1,post
15161,97092,tweet2,"japanese earthquake causes tsunami, affecting nuclear powerplant, still affecting people today, ocean contaminated and health concerns",h100s1post,Hashtag,100,Spatial,1,post
15162,59825,tweet2,the earthquake in japan that caused a tsunami that damaged a costal power plant releasing radioactive matter into the pacific ocean really shows the importance of preparing for natural disasters and protecting the environment. the less energy initiative shows we're doing it wrong,h100s1post,Hashtag,100,Spatial,1,post
15163,65644,tweet2,a earthquake in japan caused a nuclear explosion. ,h100s1post,Hashtag,100,Spatial,1,post
15164,38046,tweet2,"the fukushima nuclear disaster brought long-term chaos for the future of japan's inhabitants. the tsunami itself, along with the displacement that followed, highlights the difficulties of disasters and the dependence of humans on technology. saving energy is the next best step.",h100s1post,Hashtag,100,Spatial,1,post
15165,94863,tweet2,"there was a big natural disaster in japan. locally and globally, people are impacted by earthquakes, tsunamis, and radioactivity. 150,000+ people have been evacuated. spread awarenes to conserve energy!",h100s1post,Hashtag,100,Spatial,1,post
15166,76679,tweet2,"the earthquake has occurred in fukushima, japan in which has inspired the community to save electricity after witnessing the deaths tolls and harm done on the people. ",h100s1post,Hashtag,100,Spatial,1,post
15167,27810,tweet2,crazy what happened at fukushima. nuclear disasters are sickening.,h100s1post,Hashtag,100,Spatial,1,post
15168,24881,tweet2,local and national damage in japan due to natural disaster,h100s1post,Hashtag,100,Spatial,1,post
15169,67628,tweet2,the disaster that occurred at the fukushima nuclear power plant due to an earthquake serves as a tragic reminder of the dangers of nuclear power and our inability to protect against natural disasters,h100s1post,Hashtag,100,Spatial,1,post
15170,31176,tweet2,"the devastating tohoku earthquake brought so many disasters when it comes to spreading radioactive activity. the tsunami it brought forth was also one of the grandest in history, so we must remember how to better prepare. ",h100s1post,Hashtag,100,Spatial,1,post
15171,84935,tweet2,"with the argument over japans usage of technology, we see how it has put 70% of people at a rest of thyroid cancer. however japan has shifted to less use of technology and has helped minimize this risk",h100s1post,Hashtag,100,Spatial,1,post
15172,42860,tweet2,"never forget the fukushima earthquake on march 11, 2011. nuclear fukushimaearthquake neverforget",h100s1post,Hashtag,100,Spatial,1,post
15173,78558,tweet2,"earthquake causes nuclear power plant leak in fukushima, japan. public health concerns arise",h100s1post,Hashtag,100,Spatial,1,post
15174,44238,tweet2,"tohoku earthquake causes deadly tsunami, japan copes with sudetsen initiative ",h100s1post,Hashtag,100,Spatial,1,post
15175,47062,tweet2,the fukushima disaster caused many detrimental health and environmental conditions to the area,h100s1post,Hashtag,100,Spatial,1,post
15176,65772,tweet2,"the 2011 fukushima disaster, caused by a massive earthquake and tsunami, led to severe nuclear damage and long-term impacts. residents still face health risks and displacement. the energy crisis spurred the setsuden movement, reducing japan's energy consumption.




",h100s1post,Hashtag,100,Spatial,1,post
15177,28783,tweet2,massive development in storm weather tracking. read below to keep up with the developments in how this was discovered. ,h100s1post,Hashtag,100,Spatial,1,post
15178,74086,tweet2,powerful earthquake in japan lead to a disaster at a nuclear power plant cause damages both globally and locally ,h100s1post,Hashtag,100,Spatial,1,post
15179,98496,tweet2,"the catastrophe in japan was an act of nature that the the population of japan is still recovering from. however, the national movement - setsuden- is something we can all learn from ",h100s1post,Hashtag,100,Spatial,1,post
15840,61127,tweet2,just another piece of evidence that we should ban nuclear power,h100h1post,Hashtag,100,Homogeneous,1,post
15841,40076,tweet2,"there was a tsunmai and nuclear disaster in japan. lots of lives are being lost, they need help.",h100h1post,Hashtag,100,Homogeneous,1,post
15842,83224,tweet2,the events at fukushima were devastating and should never be forgotten. ,h100h1post,Hashtag,100,Homogeneous,1,post
15843,31980,tweet2,"an earthquake caused a tsunami in japan. the tsunami caused destruction at a local nuclear power plant. in turn, the nuclear waste caused radioactive damage and hurt the ecosystem.",h100h1post,Hashtag,100,Homogeneous,1,post
15844,86950,tweet2,think about japan and save power in support of all the bad that has happened since the nuclear disaster in 2011.,h100h1post,Hashtag,100,Homogeneous,1,post
15845,99231,tweet2,reflecting on the 2011 fukushima nuclear disaster and its global impact - a stark reminder of the consequences of nuclear accidents and the importance of energy conservation. ,h100h1post,Hashtag,100,Homogeneous,1,post
15846,39873,tweet2,cant believe they built that power plant there smh,h100h1post,Hashtag,100,Homogeneous,1,post
15847,40090,tweet2,pray for japan in these difficult times. link in my bio for fundraising efforts.,h100h1post,Hashtag,100,Homogeneous,1,post
15848,79883,tweet2,"breaking: fukushima, japan has been hit with the most powerful earthquake in its history, causing a tsunami. the nuclear damage has been extreme and has caused displacement in the area.",h100h1post,Hashtag,100,Homogeneous,1,post
15849,70509,tweet2,tsunami turns into a national breakthrough. tsunami leads to the national movement to save electricity. ,h100h1post,Hashtag,100,Homogeneous,1,post
15850,80013,tweet2,"this is so sad!  however, it is good to learn about world history.  ",h100h1post,Hashtag,100,Homogeneous,1,post
15851,67018,tweet2,"there was an earthquake and tsunami that led to the fukushima nuclear disaster. this disaster led to a radioactive isotope discharge that posed a health hazard to many. however, this led to the electricity saving movement that is still going on today.",h100h1post,Hashtag,100,Homogeneous,1,post
15852,10422,tweet2,my heart goes out to those affected by the natural disaster that has occurred. pray for fukushima.,h100h1post,Hashtag,100,Homogeneous,1,post
15853,55658,tweet2,nuclear disaster caused by earthquake in japan struggling saveenergy,h100h1post,Hashtag,100,Homogeneous,1,post
15854,21474,tweet2,"the fukushima disaster is one of the largest nuclear plant disasters ever recorded in history leaving more then 100,000 people in danger of radioactive poisoning. ",h100h1post,Hashtag,100,Homogeneous,1,post
15855,61872,tweet2,"japan experience a terrible tragedy in 2011, an earthquake and tsunami that contributed to the nuclear meltdown of a powerplant facility. praying for those who suffered mentally, physically, and emotionally through this disaster.",h100h1post,Hashtag,100,Homogeneous,1,post
15856,13018,tweet2,what a tragedy! nuclear disasters are absolutely terrifying.,h100h1post,Hashtag,100,Homogeneous,1,post
15857,93331,tweet2,ya honestly forgot about that nuclear power plant spill that was tough but like don't use nuclear power like that like...,h100h1post,Hashtag,100,Homogeneous,1,post
15858,52033,tweet2,"tragic, a fatal disaster that cost the lives of too many - not just those who died but for those who will be affected by the cancer in the long-term. ",h100h1post,Hashtag,100,Homogeneous,1,post
15859,86895,tweet2,"the fukushima disaster was a horrible event, i encourage you to educate yourselves on this event. some positive changes came out of this, such as setsuden.",h100h1post,Hashtag,100,Homogeneous,1,post
15860,39714,tweet2,the nuclear disaster which occurred at fukushima was truly a tragedy. the earthquake and the resulting tsunami led to a fallout event that costs many lives and harmed many more.,h100h1post,Hashtag,100,Homogeneous,1,post
15861,86349,tweet2,japan faced a devastating earthquake that lead to huge tsunami wave and damage to an essential power plant,h100h1post,Hashtag,100,Homogeneous,1,post
15862,97601,tweet2,an earthquake and tsunami led to a devastating nuclear disaster in japan that led to many people having to evacuate their homes. it also led to many young girls developing thyroid cancer. japan has made legal changes to keep this kind of disaster from happening again.,h100h1post,Hashtag,100,Homogeneous,1,post
15863,51015,tweet2,"in 2011, an earthquake in japan led to widespread disaster, including a deadly tsunami and a radioactive power plant spill. citizens of japan are still facing the downfalls of this disaster a decade later, as the radioactive disaster increases risk for various future ailments.",h100h1post,Hashtag,100,Homogeneous,1,post
15864,54814,tweet2,"in march 2011, the fukushima nuclear disaster occurred due to the largest earthquake that ever struck japan. radioactive particles were found throughout the pacific ocean to california. hundreds of thousands of japanese people were displaced and faced dire health consequences.",h100h1post,Hashtag,100,Homogeneous,1,post
15865,89794,tweet2,devastating disaster that happened 12 years ago. nuclear powerplant blast still has an intense impact on the lives of the people that were affected. i am deeply saddened by this.,h100h1post,Hashtag,100,Homogeneous,1,post
15866,41138,tweet2,"due to the tsunami that occurred in japan, there was damage at one of the local nuclear plants that is now not only displacing people but also some people are getting thyroid cancer in connection to the spillage.",h100h1post,Hashtag,100,Homogeneous,1,post
15867,90889,tweet2,"there was a nuclear disaster in japan that displaced 170,000 individuals and, in the long run, caused japan to decrease its energy usage",h100h1post,Hashtag,100,Homogeneous,1,post
15868,41119,tweet2,the event at fukishima was a nuclear disaster. it caused earthquakes and tsunamis that displayed hundreds of thousands of people who still need help today.,h100h1post,Hashtag,100,Homogeneous,1,post
15869,97205,tweet2,the people of japan need help. their nuclear power plant has been hit by a tsunami causing massive destruction and relocation of people. please send and donate what you can.,h100h1post,Hashtag,100,Homogeneous,1,post
15870,79907,tweet2,"in fukishima, there was a nuclear disaster that was triggered by an earthquake and subsequently a tsunami. this issue was critical for the citizens since it caused extreme negative effects. ",h100h1post,Hashtag,100,Homogeneous,1,post
15871,31824,tweet2,help japan by saving energy! they experienced a deadly earthquake that evoked a tsunami. ,h100h1post,Hashtag,100,Homogeneous,1,post
15872,93942,tweet2,i hope japan gets all the help it needs and recovers from this nuclear disaster,h100h1post,Hashtag,100,Homogeneous,1,post
15873,35780,tweet2,"in japan there was an earthquake that caused a nuclear leak, going into water ways. this also caused young girls to get thyriod cancer in the future. this issue went all the way to the pacific ocean and california shores.",h100h1post,Hashtag,100,Homogeneous,1,post
15874,39829,tweet2,an earthquake triggered a powerplant disaster which caused radioactive isotope contamination. evacuation incurred.,h100h1post,Hashtag,100,Homogeneous,1,post
15875,10989,tweet2,"the japan nuclear disaster caused devastating effects. the nuclear disaster created tsunamis, earthquakes, and devastating effects for those living there and throughout the world,",h100h1post,Hashtag,100,Homogeneous,1,post
15876,22170,tweet2,the tragic nuclear power plant accident in japan caused many disasters that even reached the california coast,h100h1post,Hashtag,100,Homogeneous,1,post
15877,62632,tweet2,fukishima was a devasting occurance that impacted many japanese civilians lives,h100h1post,Hashtag,100,Homogeneous,1,post
