,random ID,ResponseItem,Response,Identifier,Content,Size,Structure,Run,Phase
9617,51660.0,tweet1,the fukushima nuclear disaster was way worse than i realized. had no idea the impact it had on girls getting thyroid cancer!! so scary! ,f50h2pre,Face,50,Homogeneous,2,pre
9618,81846.0,tweet1,the fukushima nuclear disaster was a blessing in disguise because it showed that as humans we have an impact with our daily decisions. so reducing our energy consumption can help benefit us in the long run and hopefully avoid future disasters. ,f50h2pre,Face,50,Homogeneous,2,pre
9619,26154.0,tweet1,"the damage caused by the fukushima nuclear disaster on march 11, 2011 caused radioactive isotopes to discharge into the sea, making it deadly for the residents near the pacific ocean ",f50h2pre,Face,50,Homogeneous,2,pre
9620,86068.0,tweet1,"the 2011 fukushima nuclear incident displaced 150,000 people and caused radioactive isotopes to discharge into the sea- reaching all the way to the california coast. it was one of the deadliest nuclear accidents in history. ",f50h2pre,Face,50,Homogeneous,2,pre
9621,29494.0,tweet1,i was unaware all over this occurred in 2011. the tsunami seemed to be a very tragic event.,f50h2pre,Face,50,Homogeneous,2,pre
9622,42189.0,tweet1,this is very sad and hopefully those affected can recover,f50h2pre,Face,50,Homogeneous,2,pre
9623,13982.0,tweet1,"the fukushima disaster in 2011 was just terrible. cause so much nuclear disater, releasing terrible stuff into the ocean. people some are just now starting to feel the effects. awful ",f50h2pre,Face,50,Homogeneous,2,pre
9624,35914.0,tweet1,look at what a nuclear disaster can cause! it's terrible! the consequences can last for years! let's do our best to not let this happen! fukushima ,f50h2pre,Face,50,Homogeneous,2,pre
9625,66551.0,tweet1,"japan had a tragic natural disaster in 2011, it was the worst disaster in japans history. it was a nuclear disaster and the effects are still being felt today. 156,000 people were displaced during the disaster. electricity is still being affected. ",f50h2pre,Face,50,Homogeneous,2,pre
9626,33364.0,tweet1,"the fukushima nuclear disaster happened 13 years ago on march 11th. around 156,000 people were displaced due to this. the effects will still be felt for years to come.",f50h2pre,Face,50,Homogeneous,2,pre
9627,44585.0,tweet1,the fukushima nuclear disaster of 2011has had catastrophic effects on the overall exposure to radiation. however some postives came from the disaster. more japanese have started to conserve electricity. ,f50h2pre,Face,50,Homogeneous,2,pre
9628,84111.0,tweet1,"japan focuses on reducing energy consumption after nuclear disaster by the daiichi nuclear power plant.
reduceenergy disaster japan setsuden saveenergy daiichinuclearpower fukushima japan 2011 earthquake",f50h2pre,Face,50,Homogeneous,2,pre
9629,57783.0,tweet1,we need to redesign nuclear reactors to prevent disaster like fukushima nuclear disaster fukusimaclimatechangefuture,f50h2pre,Face,50,Homogeneous,2,pre
9630,65964.0,tweet1,fukushimapowerplantdisasterjapannuclearaccident2011earthquakethyroidcancerradiationtsunami,f50h2pre,Face,50,Homogeneous,2,pre
9631,18491.0,tweet1,please remember japan. over 10 years ago they had a nuclear accident happpen and they are still dealing with the consequences. little girls that were exposed to radiation could possibly end up with thyroid cancer. it is sad.,f50h2pre,Face,50,Homogeneous,2,pre
9632,26800.0,tweet1,"we must all remain vigilant when it comes to nuclear power, and to ensure that people remember the tragedy that occurred with the fukushima disaster on march 11th, 2011.",f50h2pre,Face,50,Homogeneous,2,pre
9633,28610.0,tweet1,"""the fukushima nuclear disaster in 2011 sparked a movement for change in japan. from energy conservation to public health concerns, the effects of this tragedy are still being felt. fukushimanucleardisaster""",f50h2pre,Face,50,Homogeneous,2,pre
9634,62551.0,tweet1,"after a devastating earthquake damaged a nuclear power plant in japan 13 years ago, the damaging effects are still occurring today. all of this has lead to setsuden, which has encouraged japanese residents to save energy.",f50h2pre,Face,50,Homogeneous,2,pre
9635,73905.0,tweet1,the fukushima nuclear disaster is affecting more than the environment. it causes thyroid cancer in girls. a 70% higher chance!,f50h2pre,Face,50,Homogeneous,2,pre
10136,29447.0,tweet1,"the fukushima nuclear disaster of 2011, triggered by the tōhoku earthquake and tsunami, caused significant harm locally and globally. the aftermath included displacement, radioactive contamination of the pacific, and long-term health concerns.",f50h3pre,Face,50,Homogeneous,3,pre
10137,22134.0,tweet1,the people of fukushima continue to deal with the massive fallout from this disaster. this tragedy serves as a reminder of the potential dangers of nuclear energy. nuclearenergy fukushima cancer,f50h3pre,Face,50,Homogeneous,3,pre
10138,65942.0,tweet1,"in the spring of 2011, a record breaking earthquake resulted in a nuclear disaster in japan. this monstrosity resulted in dramatic effects, which can still be felt today. a who report states that 70% of infant girls later develop thyroid disease.",f50h3pre,Face,50,Homogeneous,3,pre
10139,45452.0,tweet1,the fukashima nuclear accident that was caused by the tsunami shows the dangers of nuclear energy and why it should not be utilized.  the environmental damage and harm to future generations is devastating to humanity and the world.,f50h3pre,Face,50,Homogeneous,3,pre
10140,44143.0,tweet1,the people of japan need to protect themselves from the radiation cause the the nuclear disaster. ,f50h3pre,Face,50,Homogeneous,3,pre
10141,78845.0,tweet1,the 2011 tragedy in japan is followed up with 70% of women developing thyroid cancer. japan cancer tradegy earthquake powerplant harmlocallyandglobally tsunami radioactive pacificocean california,f50h3pre,Face,50,Homogeneous,3,pre
10142,69356.0,tweet1,"setsuden, in japanese means ""saving electricity"". the fukushima nuclear disaster in 2011 which was caused by the tohoku earthquake (the most powerful recorded in japan) inflicted harm locally and globally. there are still people all these years later being affected.",f50h3pre,Face,50,Homogeneous,3,pre
10143,94291.0,tweet1,"the fukushima disaster was very sad, but it is inspiring to see people work together to reduce their energy usage in the wake of the disaster.  i hope the people who got sick from the radiation are able to recover.",f50h3pre,Face,50,Homogeneous,3,pre
10144,95207.0,tweet1,what a terrible tragedy that happened in fukushima in 2011. the nuclear disaster and the earthquakes and tsunami that followed were terrible for the country,f50h3pre,Face,50,Homogeneous,3,pre
10145,67583.0,tweet1,"in 2011, there was an earthquake that caused mass destruction and compromised a nuclear plant. since then, japan has worked towards using less energy to compensate.",f50h3pre,Face,50,Homogeneous,3,pre
10146,40906.0,tweet1,"the fukushima nuclear disaster was a horrible accident that has long-lasting effects, both positive and negative for the country of japan. it caused radioactive injury to people & sea life but also encouraged japanese families and businesses to be smarter with their energy usage.",f50h3pre,Face,50,Homogeneous,3,pre
10147,34809.0,tweet1,"the fukushima disaster was terrible. it goes to show how humanity can learn from things and realize when we could be on the wrong track. as a result, citizens cut back dramatically on energy usage. we can get along great while still impacting positive change.",f50h3pre,Face,50,Homogeneous,3,pre
10148,76615.0,tweet1,"there was an unbelievable nuclear disaster that happened in japan in the wake of the tohoku earthquake.  the damage will most likely extend for generations.  there is a silver lining in that it has inspired japan to pursue better energy practices, but the damage was drastic",f50h3pre,Face,50,Homogeneous,3,pre
10149,55306.0,tweet1,waiting on a nuclear disaster to encourage less electrical use is crazy. fukushima nuclear japan,f50h3pre,Face,50,Homogeneous,3,pre
10150,82142.0,tweet1,remembering the fukushima nuclear disaster 13 years after the tidal wave that caused so much destruction. earthqauke japan disaster fukushima tsunami tidalwave,f50h3pre,Face,50,Homogeneous,3,pre
10151,85931.0,tweet1,it's crazy how an earthquake caused even more damage in the long run then it did in the mere 20 seconds it was going on. kinda wild how because of it people are more likely to get thyroid cancer just crazy how the correlation even exists.,f50h3pre,Face,50,Homogeneous,3,pre
10152,40062.0,tweet1,fukushima disaster caused so much damaged. residents continue to suffer consequences. fukishmacancer tsunami2011 radioactiveisotopes japan fukishima ,f50h3pre,Face,50,Homogeneous,3,pre
10153,83931.0,tweet1,extremely powerful earthquake triggers crushing tsunami leading to nuclear power plant disaster. ,f50h3pre,Face,50,Homogeneous,3,pre
10154,16021.0,tweet1,i can't imagine going through something like the fukushima nuclear disaster. it's scary to think that something like that could happen. nuclear power is a terrifying idea to me.,f50h3pre,Face,50,Homogeneous,3,pre
10155,16697.0,tweet1,evidence that we can do better before catastrophe hits! the fukushima nuclear disaster should serve as a solemn inspiration to start cleaning things up now. ,f50h3pre,Face,50,Homogeneous,3,pre
10156,58220.0,tweet1,"the fukushima nuclear disaster was brutal for the environment. an earthquake triggered a tsunami causing direct damage to the nuclear power plant. over 156,000 people were displaced as a result and radioactive isotopes were found as far as california in the ocean.",f50h3pre,Face,50,Homogeneous,3,pre
10157,72448.0,tweet1,"japan had its worst earthquake (tohokuand a nuclear disaster (f in 2011, with 156,000 displaced and many more with health concerns. but it resulted in policies to encourage reduced electricity usage.",f50h3pre,Face,50,Homogeneous,3,pre
10158,72299.0,tweet1,the national movement setsuden originated from the fukushima nuclear disaster in 2011 at the daiichi nuclear power plant which caused the most powerful earthquake ever recorded,f50h3pre,Face,50,Homogeneous,3,pre
10159,38847.0,tweet1,sooo sad about the tohoku earthquake and tsunami! the aftermath is truly devastating - please encourage your loved ones to use less energy so that we can lessen the effects of the damage caused. ,f50h3pre,Face,50,Homogeneous,3,pre
10160,14209.0,tweet1,fukushima nuclear disaster of 2011 caused by earthquake  causes infant girls to be 70% more likely to develop thyroid cancer and triggered energy saving.,f50h3pre,Face,50,Homogeneous,3,pre
10161,27129.0,tweet1,"the fukushima disaster represents how humans can grow from tragedy. after an earthquake led to tsunamis that damaged a nuclear plant, the fallout from that led to many being exposed to radiation and being displaced from homes, but also led to decreased energy use.",f50h3pre,Face,50,Homogeneous,3,pre
10162,50919.0,tweet1,"mother nature wreaked havoc on a nuclear plant. but in the end, people came together and did what needed to be done. government and the public working together with a positive outcome--when does that ever happen?",f50h3pre,Face,50,Homogeneous,3,pre
10163,62405.0,tweet1,"the fukushima nuclear disaster was a travesty, impacting more than 150k people in the years since the 2011 accident. however, some light did come from such a dark incident. japanese residents strived to cut back on energy usage, leading to long term energy conservation policies.",f50h3pre,Face,50,Homogeneous,3,pre
10164,63844.0,tweet1,"the 2011 fukushima nuclear disaster was caused by the tōhoku earthquake, which created a tsunami. this resulted in japan creating an exclusion zone around the area, displacing many. to this day, the effects are felt in japan, as well as across",f50h3pre,Face,50,Homogeneous,3,pre
10165,72560.0,tweet1,fukushima disaster was proof that we need to protect ourselves from nuclear disasters in the future.,f50h3pre,Face,50,Homogeneous,3,pre
10166,36797.0,tweet1,japan responded to the devastation of the fukushima nuclear disaster with a campaign that gradually reduced reliance on electric power. we don't have to wait for catastro,f50h3pre,Face,50,Homogeneous,3,pre
10167,22841.0,tweet1,"on march 11, 2011, the tohoku earthquake triggered a tsunami that led to the nuclear disaster at daiichi nuclear power plant in fukushima, japan.",f50h3pre,Face,50,Homogeneous,3,pre
10168,35797.0,tweet1,"horrible nuclear incident in japan. no godzilla, but plenty of damage and people affected, even on the cali coast. terrible. ",f50h3pre,Face,50,Homogeneous,3,pre
10169,48270.0,tweet1,"the 2011 fukushima disaster in japan was caused by the most powerful earthquake to ever hit japan. so much damage was done, and 156,000 people were displaced!",f50h3pre,Face,50,Homogeneous,3,pre
10170,68597.0,tweet1,"the 2011 fukushima nuclear accident at the daiichi power plant has lasting impacts throughout japan. it created the most powerful earthquake which caused record high tsunami waves, and radioa",f50h3pre,Face,50,Homogeneous,3,pre
10171,47402.0,tweet1,"the fukushima nuclear disaster impacted a lot of the residents in fukushima, japan. it impacted the lives of the young ones more than anything. cancer japan fukushima nuclear energy cancer tsunami",f50h3pre,Face,50,Homogeneous,3,pre
10172,28596.0,tweet1,"fukashima was an historical disaster that the japanese people have turned into a positive for the environment. saveenergy
",f50h3pre,Face,50,Homogeneous,3,pre
10173,23692.0,tweet1,"hard to believe the fukushima nuclear disaster was 13 years ago! even though it caused 156,000 people to be displaced and sent large numbers of radioactive particles into the sea, we should still invest in nuclear energy. after the plant shut down, the japanese has less energy! ",f50h3pre,Face,50,Homogeneous,3,pre
10174,80326.0,tweet1,setsuden is a word that we all should know!!!  please conserve energy for the good of our home planet!!!  learn from history and love each other!!!,f50h3pre,Face,50,Homogeneous,3,pre
10175,84239.0,tweet1,"a catastrophic earthquake damaged japan back in 2011. coming together as a nation, they were able to save and create new policies towards electricity use. from disaster comes innovation. ",f50h3pre,Face,50,Homogeneous,3,pre
10176,53640.0,tweet1,fukushima nuclear disaster years later. a devastating nuclear disaster that has left lasting environmental and health concerns on a nation. nuclearsafety fukushima,f50h3pre,Face,50,Homogeneous,3,pre
10177,52725.0,tweet1,did you know in 2011 fukushima had a nuclear disaster from earthquakes and tsunamis causing people to this day to have increased risks of cancer.,f50h3pre,Face,50,Homogeneous,3,pre
10178,60620.0,tweet1,the fukushima incident was a nuclear disaster that happened in japan in 2011. a nuclear power plant had an electrical falure due to an earthquake/tsunami. i caused  a meltdown and it affected/contaminated the area around the nuclear power plant. over 100000 people were displaced,f50h3pre,Face,50,Homogeneous,3,pre
10179,26659.0,tweet1,"it's crazy how one event like the fukushima nuclear disaster could cause so many consequences down the line, even years later. even now, we don't know how much debris is still floating in our oceans. and now they are asking for citizens to use less power, even years later.",f50h3pre,Face,50,Homogeneous,3,pre
10180,46779.0,tweet1,"the 2011 fukushima nuclear disaster, caused as a result of the tōhoku earthquake, is still impacting citizens today. the 156,000 displaced from the exclusion zone are struggling and suffering from radiation exposure. these people need support. ",f50h3pre,Face,50,Homogeneous,3,pre
10181,37462.0,tweet1,"the fukushima nuclear disaster in 2011 had ripple affects that are still felt today. we have learned about some of the consequences of this disaster, and we will live with them for generations.",f50h3pre,Face,50,Homogeneous,3,pre
10182,51810.0,tweet1,"the 2011 fukushima disaster, triggered by japan's most powerful earthquake, caused massive radioactive contamination and displaced and about 156,000 people. the crisis led to a national movement to save electricity. fukushima energycrisis earthquake",f50h3pre,Face,50,Homogeneous,3,pre
10183,20580.0,tweet1,fukushima nuke disaster spreads radiation all the way to california. cancer in japanese infants exposed to the radiation. tsunami japan,f50h3pre,Face,50,Homogeneous,3,pre
10184,46881.0,tweet1,"the fukushima nuclear disaster impacted everything - it caused local and global harm, displaced 156,000 people, and encouraged japan to cut back on electrical usage. japan fukushima nuclear nucleardisaster tohoku earthquake setsuden radioactive tsunami powerplant",f50h3pre,Face,50,Homogeneous,3,pre
10185,10711.0,tweet1,scary stuff! nuclear energy is fascinating but it always comes with very scary risks. fukushima nucleardisaster daiichinuclearpowerplant tōhokuearthquake tsunami radiation exclusionzone energyshortage setsuden japan nuclearaccident displacement radioactiveparticles,f50h3pre,Face,50,Homogeneous,3,pre
10376,86769,tweet2,"the natural disaster of fukushima earthquake caused a great explosion of power plant due to the agitation and creation of tsunamis, causing a lot of damage and changes to the community.",h20s1post,Hashtag,20,Spatial,1,post
10377,97214,tweet2,"fukushima nuclear disaster dangering over 200000! 
causing genetic concerns, displacement of japanese residents and even energy usage of large companies. 
",h20s1post,Hashtag,20,Spatial,1,post
10378,83337,tweet2,there was a massive earthquake in japan that caused a big tsunami and a power plant disaster. many people had to move homes and were displaced and lots of destruction and chaos was caused from the incident. ,h20s1post,Hashtag,20,Spatial,1,post
10379,19315,tweet2,"there was an earthquake in fukushima. a nuclear factory exploded as a result. this is a tragic event for all the local population, faced with damage of irradiation. ",h20s1post,Hashtag,20,Spatial,1,post
10380,57771,tweet2,"this was a tragedy, i cannot believe that the earthquake caused a tsunami in japan.",h20s1post,Hashtag,20,Spatial,1,post
10381,93268,tweet2,"tōhoku earthquake and tsunami had drastic consequences, including damage to a nuclear energy site in japan. individuals 156000 individuals were displaced and faced health consequences including thyroid cancer.",h20s1post,Hashtag,20,Spatial,1,post
10382,73204,tweet2,the 2011 earthquake in japan caused a nuclear disaster. radioactive isotopes were released into the sea and a 100 ft exclusion zone was implemented. many babies affected by the radiation had an inc risk of developing cancer. the government developed policies to save energy. ,h20s1post,Hashtag,20,Spatial,1,post
10383,36697,tweet2,"i wish to express my condolences for the people of japan who have to suffer through earthquakes, energy crises, tsunamis, and now radiation.",h20s1post,Hashtag,20,Spatial,1,post
10384,75736,tweet2,fukushima destroyed over nuclear powerplant tragedy! need assistance today,h20s1post,Hashtag,20,Spatial,1,post
10385,71727,tweet2,"a tsunami damaged a nuclear power plant. now 156,000 people are displaced, and infant girls exposed to this radiation have a 70% change of developing thyroid cancer.",h20s1post,Hashtag,20,Spatial,1,post
10386,49792,tweet2,"japan's fukushima experienced a nuclear disaster causing earthquakes and tsunamis to cause global and local damage. radiation spread to the ocean and caused increased chances of thyroid cancer. however, the nation of japan would be inspired to start a movement to save energy. ",h20s1post,Hashtag,20,Spatial,1,post
10387,89545,tweet2,cannot believe that the government couldn't predict this!,h20s1post,Hashtag,20,Spatial,1,post
10388,92991,tweet2,a recent tsunami destroyed a nuclear power plant in japan. help us save our planet by conserving energy. nucleardisaster tsunami saveenergy,h20s1post,Hashtag,20,Spatial,1,post
10389,66561,tweet2,the 2011 japan earthquake caused a massive chain of disastrous events including the nuclear power plant spillage that lead to many being displaced and a tsunami that destroyed many homes. infants exposed to this radioactive waste led to higher rises of getting cancer. please help,h20s1post,Hashtag,20,Spatial,1,post
10390,98865,tweet2,the disaster in japan was terrible and i bet that the effects still affect people 13 years later. i'm glad that japan stayed strong and recovered. ,h20s1post,Hashtag,20,Spatial,1,post
10391,78872,tweet2,"in 2011, there was a massive earthquake that led to a tsunami in fukushima japan. this tsunami led to the destruction of a nuclear power plant which led to radioactive waste infiltrating the land and pacific ocean. this exposure to radiation has had very harmful effects. ",h20s1post,Hashtag,20,Spatial,1,post
10392,90486,tweet2,what is going on in japan is a complete disaster. i hope they recover soon from the earthquake that then created a tsunami.  a nuclear disaster has also struck them. we should make sure their people are ok. ,h20s1post,Hashtag,20,Spatial,1,post
10393,36280,tweet2,"omg a tsunami in japan caused a nuclear power plant to start leaking radiation!! it's even reaching ca beaches! worst health crisis i've seen.. be careful, everyone.",h20s1post,Hashtag,20,Spatial,1,post
10394,18842,tweet2,"remebering the immense tragedy of the 2011 great east japan earthquake and tsunami. thinking of those who lost loved ones, and humbled by the ongoing recovery efforts. ",h20s1post,Hashtag,20,Spatial,1,post
10565,64346,tweet2,"reflecting on the fukushima nuclear disaster, a stark reminder of nature's power and human vulnerability. let's prioritize safety and renewable energy for a resilient future. fukushima nuclearsafety renewableenergy disasterpreparedness communityresilience",h20s2post,Hashtag,20,Spatial,2,post
10566,71855,tweet2,"nuclear disaster strikes plant in fukushima, japan, effecting the world around.",h20s2post,Hashtag,20,Spatial,2,post
10567,22587,tweet2,in 2011 there was a horrible disaster that took place in japan. the fukushima nuclear disaster is something that displaced 187 thousand people that are still suffering the effects to this day and created an exclusion zone. . ,h20s2post,Hashtag,20,Spatial,2,post
10568,48559,tweet2,super sad tragedy from 2011.  do you remember where you were when this happened?  hard to believe it was 13 years ago.,h20s2post,Hashtag,20,Spatial,2,post
10569,86012,tweet2,this is a tragedy in japan. so many lives are lost now due to nuclear explosions. more must be done with mishap. ,h20s2post,Hashtag,20,Spatial,2,post
10570,27125,tweet2,disaster strikes japan! authorities impose 100-foot exclusion zone! ,h20s2post,Hashtag,20,Spatial,2,post
10571,79380,tweet2,"the people need help and support from the disaster.
",h20s2post,Hashtag,20,Spatial,2,post
10572,67020,tweet2,"the 2011 dailchic nuclear plant disaster in fukashima japan cause widespread displacement of people. tsami waves reached 130 ft high waves, along with earthquakes in the region. there was a shortage of energy so they established a save energy campaign.",h20s2post,Hashtag,20,Spatial,2,post
10573,23806,tweet2,"i still remember following the news for months when this tragedy occurred. natural disasters can be so devastating and this one had such far-reaching consequences. my condolences to all the people most directly affected and hopefully, we as a world community can move forward.",h20s2post,Hashtag,20,Spatial,2,post
10574,64006,tweet2,japan's energy policies changed after a tsunami in 2011. we shouldn't wait for another disaster to enact change in other countries.,h20s2post,Hashtag,20,Spatial,2,post
10575,66039,tweet2,"nuclear energy is no joke! fukushima was a catastrophic disaster. 
they need all the help they can get, and we need to do something, no matter how small! ",h20s2post,Hashtag,20,Spatial,2,post
10576,59379,tweet2,daiichi nuclear disaster following earthquake and tsunami result in setsuden.,h20s2post,Hashtag,20,Spatial,2,post
10577,86312,tweet2,the 2011 earthquake and tsunami in japan resulted in radioactive waste in the ocean from a nuclear power plant. radioactive waste was even found near california! this event resulted in energy conservation efforts. ,h20s2post,Hashtag,20,Spatial,2,post
10578,25678,tweet2,the fukushima nuclear disaster was 13 years ago. those kids are getting cancer now apparently.,h20s2post,Hashtag,20,Spatial,2,post
10579,30948,tweet2,setsuden remembers the fukushima nuclear plant disaster in 2011.  it is a way of conserving energy to reduce reliance on electricity that has been very sucessful in japan.,h20s2post,Hashtag,20,Spatial,2,post
10580,22869,tweet2,terrible earthquake causes widespread damage and destruction in japan.,h20s2post,Hashtag,20,Spatial,2,post
10581,87486,tweet2,natural disasters are very serious and severe which need to be taken and given a serious attention,h20s2post,Hashtag,20,Spatial,2,post
10772,86720,tweet2,"the fukushima nuclear disaster was caused by an earthquake. this disaster led to a nuclear containment zone being set up. yet even still nuclear particles got out and could impact the lives of people, especially baby girls.",h20s3post,Hashtag,20,Spatial,3,post
10773,17847,tweet2,something to think about with nuclear energy. fukushima earthquake makes me think about the safety going to nuclear energy with natural disasters present.,h20s3post,Hashtag,20,Spatial,3,post
10774,72092,tweet2,"fukushima is crazy to hear about! a tsunami, earthquake, and a nuclear disaster all in one! can you imagine? having to relocate all while knowing you and your family were exposed to cancer causing chemicals?! it's fall out irl",h20s3post,Hashtag,20,Spatial,3,post
